{
    "project": {
        "title": "PlugFest",
        "documentation": {
            "german": "<?xml version='1.0' encoding='UTF-8' ?>\n<html xmlns=\"http://www.w3.org/1999/xhtml\"><head/><body><p>Dieses Projekt dient prim채r der Demonstration der Werkzeugunterst체tzung im Rahmen des AP 4.1. Es enth채lt lediglich einen Dienst namens Shuttle-Service. Dieser bietet Funktionen f체r die Nutzung eines On-Demand-Ride-Sharing-Dienstes an.</p></body></html>",
            "english": "<?xml version='1.0' encoding='UTF-8' ?>\n<html xmlns=\"http://www.w3.org/1999/xhtml\"><head/><body><p/></body></html>"
        }
    },
    "elements": [
        {
            "ncname": "GetOffersRequest",
            "documentation": {
                "english": "<p xmlns=\"http://www.w3.org/1999/xhtml\"><br /></p>",
                "german": "<p xmlns=\"http://www.w3.org/1999/xhtml\"><br /></p>"
            }
        },
        {
            "ncname": "GetOffersResponse",
            "documentation": {
                "english": "<p xmlns=\"http://www.w3.org/1999/xhtml\"><br /></p>",
                "german": "<p xmlns=\"http://www.w3.org/1999/xhtml\"><br /></p>"
            }
        },
        {
            "ncname": "BookingRequest",
            "documentation": {
                "english": "<p xmlns=\"http://www.w3.org/1999/xhtml\"><br /></p>",
                "german": "<p xmlns=\"http://www.w3.org/1999/xhtml\"><br /></p>"
            }
        },
        {
            "ncname": "BookingResponse",
            "documentation": {
                "english": "<p xmlns=\"http://www.w3.org/1999/xhtml\"><br /></p>",
                "german": "<p xmlns=\"http://www.w3.org/1999/xhtml\"><br /></p>"
            }
        }
    ],
    "datatypes": [
        {
            "ncname": "GeneralErrorType",
            "documentation": {
                "german": "<?xml version='1.0' encoding='UTF-8' ?>\n<html xmlns=\"http://www.w3.org/1999/xhtml\"><head/><body><p/></body></html>",
                "english": "<?xml version='1.0' encoding='UTF-8' ?>\n<html xmlns=\"http://www.w3.org/1999/xhtml\"><head/><body><p/></body></html>"
            }
        },
        {
            "ncname": "GetOffersRequestType",
            "documentation": {
                "german": "<?xml version='1.0' encoding='UTF-8' ?>\n<html xmlns=\"http://www.w3.org/1999/xhtml\"><head/><body><p/></body></html>",
                "english": "<?xml version='1.0' encoding='UTF-8' ?>\n<html xmlns=\"http://www.w3.org/1999/xhtml\"><head/><body><p/></body></html>"
            }
        },
        {
            "ncname": "FlexibleGeoLocationType",
            "documentation": {
                "german": "<?xml version='1.0' encoding='UTF-8' ?>\n<html xmlns=\"http://www.w3.org/1999/xhtml\"><head/><body><p/></body></html>",
                "english": "<?xml version='1.0' encoding='UTF-8' ?>\n<html xmlns=\"http://www.w3.org/1999/xhtml\"><head/><body><p/></body></html>"
            }
        },
        {
            "ncname": "GeoLocationType",
            "documentation": {
                "german": "<?xml version='1.0' encoding='UTF-8' ?>\n<html xmlns=\"http://www.w3.org/1999/xhtml\"><head/><body><p/></body></html>",
                "english": "<?xml version='1.0' encoding='UTF-8' ?>\n<html xmlns=\"http://www.w3.org/1999/xhtml\"><head/><body><p/></body></html>"
            }
        },
        {
            "ncname": "GetOffersResponseType",
            "documentation": {
                "german": "<?xml version='1.0' encoding='UTF-8' ?>\n<html xmlns=\"http://www.w3.org/1999/xhtml\"><head/><body><p/></body></html>",
                "english": "<?xml version='1.0' encoding='UTF-8' ?>\n<html xmlns=\"http://www.w3.org/1999/xhtml\"><head/><body><p/></body></html>"
            }
        },
        {
            "ncname": "GetOffersSuccessResponseType",
            "documentation": {
                "german": "<?xml version='1.0' encoding='UTF-8' ?>\n<html xmlns=\"http://www.w3.org/1999/xhtml\"><head/><body><p/></body></html>",
                "english": "<?xml version='1.0' encoding='UTF-8' ?>\n<html xmlns=\"http://www.w3.org/1999/xhtml\"><head/><body><p/></body></html>"
            }
        },
        {
            "ncname": "OfferType",
            "documentation": {
                "german": "<?xml version='1.0' encoding='UTF-8' ?>\n<html xmlns=\"http://www.w3.org/1999/xhtml\"><head/><body><p/></body></html>",
                "english": "<?xml version='1.0' encoding='UTF-8' ?>\n<html xmlns=\"http://www.w3.org/1999/xhtml\"><head/><body><p/></body></html>"
            }
        },
        {
            "ncname": "ActualGeoLocationType",
            "documentation": {
                "german": "<?xml version='1.0' encoding='UTF-8' ?>\n<html xmlns=\"http://www.w3.org/1999/xhtml\"><head/><body><p/></body></html>",
                "english": "<?xml version='1.0' encoding='UTF-8' ?>\n<html xmlns=\"http://www.w3.org/1999/xhtml\"><head/><body><p/></body></html>"
            }
        },
        {
            "ncname": "ActualTimeType",
            "documentation": {
                "german": "<?xml version='1.0' encoding='UTF-8' ?>\n<html xmlns=\"http://www.w3.org/1999/xhtml\"><head/><body><p/></body></html>",
                "english": "<?xml version='1.0' encoding='UTF-8' ?>\n<html xmlns=\"http://www.w3.org/1999/xhtml\"><head/><body><p/></body></html>"
            }
        },
        {
            "ncname": "GetOffersErrorResponseType",
            "documentation": {
                "german": "<?xml version='1.0' encoding='UTF-8' ?>\n<html xmlns=\"http://www.w3.org/1999/xhtml\"><head/><body><p/></body></html>",
                "english": "<?xml version='1.0' encoding='UTF-8' ?>\n<html xmlns=\"http://www.w3.org/1999/xhtml\"><head/><body><p/></body></html>"
            }
        },
        {
            "ncname": "BookingRequestType",
            "documentation": {
                "german": "<?xml version='1.0' encoding='UTF-8' ?>\n<html xmlns=\"http://www.w3.org/1999/xhtml\"><head/><body><p/></body></html>",
                "english": "<?xml version='1.0' encoding='UTF-8' ?>\n<html xmlns=\"http://www.w3.org/1999/xhtml\"><head/><body><p/></body></html>"
            }
        },
        {
            "ncname": "BookingResponseType",
            "documentation": {
                "german": "<?xml version='1.0' encoding='UTF-8' ?>\n<html xmlns=\"http://www.w3.org/1999/xhtml\"><head/><body><p/></body></html>",
                "english": "<?xml version='1.0' encoding='UTF-8' ?>\n<html xmlns=\"http://www.w3.org/1999/xhtml\"><head/><body><p/></body></html>"
            }
        },
        {
            "ncname": "BookingSuccessResponseType",
            "documentation": {
                "german": "<?xml version='1.0' encoding='UTF-8' ?>\n<html xmlns=\"http://www.w3.org/1999/xhtml\"><head/><body><p/></body></html>",
                "english": "<?xml version='1.0' encoding='UTF-8' ?>\n<html xmlns=\"http://www.w3.org/1999/xhtml\"><head/><body><p/></body></html>"
            }
        },
        {
            "ncname": "BookingErrorResponseType",
            "documentation": {
                "german": "<?xml version='1.0' encoding='UTF-8' ?>\n<html xmlns=\"http://www.w3.org/1999/xhtml\"><head/><body><p/></body></html>",
                "english": "<?xml version='1.0' encoding='UTF-8' ?>\n<html xmlns=\"http://www.w3.org/1999/xhtml\"><head/><body><p/></body></html>"
            }
        },
        {
            "ncname": "LatitudeType",
            "documentation": {
                "german": "<?xml version='1.0' encoding='UTF-8' ?>\n<html xmlns=\"http://www.w3.org/1999/xhtml\"><head/><body><p/></body></html>",
                "english": "<?xml version='1.0' encoding='UTF-8' ?>\n<html xmlns=\"http://www.w3.org/1999/xhtml\"><head/><body><p/></body></html>"
            }
        },
        {
            "ncname": "LongitudeType",
            "documentation": {
                "german": "<?xml version='1.0' encoding='UTF-8' ?>\n<html xmlns=\"http://www.w3.org/1999/xhtml\"><head/><body><p/></body></html>",
                "english": "<?xml version='1.0' encoding='UTF-8' ?>\n<html xmlns=\"http://www.w3.org/1999/xhtml\"><head/><body><p/></body></html>"
            }
        },
        {
            "ncname": "GetOffersErrorCodeType",
            "documentation": {
                "german": "<?xml version='1.0' encoding='UTF-8' ?>\n<html xmlns=\"http://www.w3.org/1999/xhtml\"><head/><body><p/></body></html>",
                "english": "<?xml version='1.0' encoding='UTF-8' ?>\n<html xmlns=\"http://www.w3.org/1999/xhtml\"><head/><body><p/></body></html>"
            }
        },
        {
            "ncname": "BookingErrorCodeType",
            "documentation": {
                "german": "<?xml version='1.0' encoding='UTF-8' ?>\n<html xmlns=\"http://www.w3.org/1999/xhtml\"><head/><body><p/></body></html>",
                "english": "<?xml version='1.0' encoding='UTF-8' ?>\n<html xmlns=\"http://www.w3.org/1999/xhtml\"><head/><body><p/></body></html>"
            }
        }
    ],
    "functions": [
        {
            "ncname": "GetOffersFunction",
            "documentation": {
                "german": "<?xml version='1.0' encoding='UTF-8' ?>\n<html xmlns=\"http://www.w3.org/1999/xhtml\"><head/><body><p/></body></html>",
                "english": "<?xml version='1.0' encoding='UTF-8' ?>\n<html xmlns=\"http://www.w3.org/1999/xhtml\"><head/><body><p/></body></html>"
            },
            "inputElementName": {
                "namespaceuri": "http://www.myshuttle.io",
                "ncname": "GetOffersRequest"
            },
            "outputElementName": {
                "namespaceuri": "http://www.myshuttle.io",
                "ncname": "GetOffersResponse"
            },
            "assertions": [
                {
                    "test": "every $offer in GetOffersResponse/GetOffersSuccess/Offer satisfies $offer/From/WalkWayInMeters le GetOffersRequest/From/FlexibilityInMeters"
                },